{
  "schema": 1,
  "id": "ctrl",
  "name": "ctrl",
  "version": "0.2.1",
  "protocol": 1,
  "minApp": "0.2.0",
  "code": {
    "bundleId": "ai.qrtz.ctrl",
    "teamId": "MR26CCZ496",
    "designatedRequirement": "identifier \"ai.qrtz.ctrl\" and anchor apple generic and certificate 1[field.1.2.840.113635.100.6.2.6] /* exists */ and certificate leaf[field.1.2.840.113635.100.6.1.13] /* exists */ and certificate leaf[subject.OU] = \"MR26CCZ496\""
  },
  "launch": {
    "kind": "package",
    "entry": "bin/qrtz-ctrl",
    "channels": ["ctrl.*"]
  },
  "views": ["ctrl"],
  "capabilities": ["ctrl.read", "ctrl.write", "module.settings"],
  "permissions": ["accessibility", "automation", "files-and-folders"],
  "entitlements": ["com.apple.security.automation.apple-events"],
  "settings": {
    "namespace": "ctrl",
    "legacySections": []
  },
  "provides": [],
  "dependencies": [
    {
      "id": "model:laya",
      "kind": "data",
      "version": "1.0.0",
      "sha256": "e93ef91d200f82a997e7b7aae28804af72594bd56e4963aee6f889bc83ffad22",
      "teamId": "MR26CCZ496",
      "optional": true
    }
  ]
}
