{
  "schema": 1,
  "id": "snap",
  "name": "snap",
  "version": "0.1.2",
  "protocol": 1,
  "minApp": "0.2.0",
  "code": {
    "bundleId": "ai.qrtz.snap",
    "teamId": "MR26CCZ496",
    "designatedRequirement": "identifier \"ai.qrtz.snap\" and anchor apple generic and certificate 1[field.1.2.840.113635.100.6.2.6] /* exists */ and certificate leaf[field.1.2.840.113635.100.6.1.13] /* exists */ and certificate leaf[subject.OU] = \"MR26CCZ496\""
  },
  "launch": {
    "kind": "bundled-helper",
    "entry": "qrtz-snap",
    "channels": ["snap.*"]
  },
  "views": ["snap"],
  "capabilities": [
    "snap.read",
    "config.read",
    "config.write",
    "module.settings"
  ],
  "permissions": ["accessibility"],
  "entitlements": [],
  "settings": {
    "namespace": "snap",
    "legacySections": ["snap"]
  },
  "provides": [],
  "dependencies": []
}
