{
  "schema": 1,
  "id": "echo",
  "name": "echo",
  "version": "0.2.1",
  "protocol": 1,
  "minApp": "0.2.0",
  "code": {
    "bundleId": "ai.qrtz.echo",
    "teamId": "MR26CCZ496",
    "designatedRequirement": "identifier \"ai.qrtz.echo\" and anchor apple generic and certificate 1[field.1.2.840.113635.100.6.2.6] /* exists */ and certificate leaf[field.1.2.840.113635.100.6.1.13] /* exists */ and certificate leaf[subject.OU] = \"MR26CCZ496\""
  },
  "launch": {
    "kind": "bundled-helper",
    "entry": "qrtz-echo",
    "channels": ["dictation.*", "pill.*", "insert.*"]
  },
  "views": ["talk"],
  "capabilities": [
    "talk.read",
    "talk.dictate",
    "talk.write",
    "speech.read",
    "speech.manage",
    "config.read",
    "config.write",
    "module.settings"
  ],
  "permissions": ["microphone", "accessibility"],
  "entitlements": ["com.apple.security.device.audio-input"],
  "settings": {
    "namespace": "echo",
    "legacySections": ["talk"]
  },
  "provides": [],
  "dependencies": [
    {
      "id": "model:parakeet-tdt-v2",
      "kind": "data",
      "version": "1.0.0",
      "sha256": "08834dd5e130c78b57f68d9c52265036ba3cf9c3ebe2cd092f4d0322bcd77730",
      "teamId": "MR26CCZ496"
    }
  ]
}
